{
  "$schema": "https://json-schema.org/draft/2020-12/schema",
  "$id": "https://schema.opentouring.org/otwd/v1/vocabulary.schema.json",
  "$comment": "SPDX-License-Identifier: Apache-2.0",
  "title": "OTWD governed list",
  "description": "The format of the governed lists (site-types.json, facilities.json, structures.json, surfaces.json, vehicle-access-classes.json, vehicle-classes.json, key-schemes.json and pet-species.json) and of the API responses that serve them. Codes are stable: a code is never renamed or reused. A code that is no longer wanted is marked deprecated and keeps its meaning.",
  "type": "object",
  "required": ["$schema", "list", "version", "language", "entries"],
  "properties": {
    "$schema": {
      "type": "string",
      "format": "uri"
    },
    "$comment": {
      "type": "string"
    },
    "list": {
      "$ref": "#/$defs/ListName"
    },
    "version": {
      "description": "Version of the governed list. A new entry increases the minor version. Changing an entry's meaning is not allowed.",
      "$ref": "#/$defs/ListVersion"
    },
    "language": {
      "description": "Language of the labels and descriptions. The governed list files in schema/ are always in en-AU, the reference language. Translations into other languages are separate files in schema/i18n (translation.schema.json). In an API response it is the language the API chose from Accept-Language, also sent as Content-Language, and entries with no translation in that language fall back as label_lang and description_lang say.",
      "$ref": "common.schema.json#/$defs/LanguageTag"
    },
    "entries": {
      "type": "array",
      "minItems": 1,
      "items": {
        "$ref": "#/$defs/Entry"
      }
    }
  },
  "additionalProperties": false,
  "allOf": [
    {
      "if": {
        "properties": {
          "list": {
            "const": "site_types"
          }
        }
      },
      "then": {
        "properties": {
          "entries": {
            "items": {
              "$ref": "#/$defs/SiteTypeEntry"
            }
          }
        }
      }
    },
    {
      "if": {
        "properties": {
          "list": {
            "const": "facilities"
          }
        }
      },
      "then": {
        "properties": {
          "entries": {
            "items": {
              "$ref": "#/$defs/FacilityEntry"
            }
          }
        }
      }
    },
    {
      "if": {
        "properties": {
          "list": {
            "enum": ["surfaces", "vehicle_classes", "pet_species"]
          }
        }
      },
      "then": {
        "properties": {
          "entries": {
            "items": {
              "$ref": "#/$defs/PlainEntry"
            }
          }
        }
      }
    },
    {
      "if": {
        "properties": {
          "list": {
            "const": "structures"
          }
        }
      },
      "then": {
        "properties": {
          "entries": {
            "items": {
              "$ref": "#/$defs/StructureEntry"
            }
          }
        }
      }
    },
    {
      "if": {
        "properties": {
          "list": {
            "const": "key_schemes"
          }
        }
      },
      "then": {
        "properties": {
          "entries": {
            "items": {
              "$ref": "#/$defs/KeySchemeEntry"
            }
          }
        }
      }
    },
    {
      "if": {
        "properties": {
          "list": {
            "const": "vehicle_access_classes"
          }
        }
      },
      "then": {
        "properties": {
          "entries": {
            "items": {
              "$ref": "#/$defs/RankedEntry"
            }
          }
        }
      }
    }
  ],
  "$defs": {
    "ListName": {
      "description": "The name of a governed list. The file that holds it is the name with underscores turned into hyphens, for example vehicle_access_classes in vehicle-access-classes.json.",
      "type": "string",
      "enum": [
        "site_types",
        "facilities",
        "structures",
        "surfaces",
        "vehicle_access_classes",
        "vehicle_classes",
        "key_schemes",
        "pet_species"
      ]
    },
    "ListVersion": {
      "description": "A governed list version: major.minor.patch.",
      "type": "string",
      "pattern": "^1\\.[0-9]+\\.[0-9]+$"
    },
    "Entry": {
      "type": "object",
      "required": ["code", "label", "description", "status", "introduced_in", "osm", "schema_org"],
      "properties": {
        "code": {
          "$ref": "common.schema.json#/$defs/Code"
        },
        "label": {
          "type": "string",
          "minLength": 1,
          "maxLength": 60
        },
        "description": {
          "type": "string",
          "minLength": 1,
          "maxLength": 500
        },
        "label_lang": {
          "description": "API responses only: the language the label is in, when it differs from the document's language because no translation exists and the label fell back (ADR 0031). Never present in the governed list files.",
          "$ref": "common.schema.json#/$defs/LanguageTag"
        },
        "description_lang": {
          "description": "API responses only: the language the description is in, when it differs from the document's language, with the same fallback as label_lang. Never present in the governed list files.",
          "$ref": "common.schema.json#/$defs/LanguageTag"
        },
        "status": {
          "type": "string",
          "enum": ["active", "deprecated"]
        },
        "introduced_in": {
          "$ref": "#/$defs/ListVersion"
        },
        "replaced_by": {
          "$ref": "common.schema.json#/$defs/Code"
        },
        "safety_fact": {
          "description": "True when the entry is a safety fact, which routing always sends to a moderator. Used by site types and facilities. In the other lists the fact that holds the code says whether it is a safety fact.",
          "type": "boolean"
        },
        "osm": {
          "description": "The closest OpenStreetMap tagging. An empty list means OSM has no established equivalent.",
          "type": "array",
          "items": {
            "type": "object",
            "required": ["tags", "match"],
            "properties": {
              "tags": {
                "description": "One or more key=value tags that together express the entry.",
                "type": "array",
                "minItems": 1,
                "items": {
                  "type": "string",
                  "pattern": "^[a-z0-9_:]+=[^=\\s][^=]*$"
                }
              },
              "match": {
                "description": "exact: same meaning. broader: the OSM tagging covers more than the entry. narrower: it covers less. related: useful but not equivalent.",
                "type": "string",
                "enum": ["exact", "broader", "narrower", "related"]
              },
              "note": {
                "type": "string",
                "maxLength": 300
              }
            },
            "additionalProperties": false
          }
        },
        "schema_org": {
          "description": "The closest schema.org type or property, or null when there is none.",
          "oneOf": [
            {
              "type": "null"
            },
            {
              "type": "object",
              "required": ["match"],
              "properties": {
                "type": {
                  "description": "A schema.org type, for example Campground.",
                  "type": "string",
                  "pattern": "^[A-Z][A-Za-z]+$"
                },
                "property": {
                  "description": "A schema.org property, for example amenityFeature.",
                  "type": "string",
                  "pattern": "^[a-z][A-Za-z]+$"
                },
                "value": {
                  "description": "The value to use with the property, for example the LocationFeatureSpecification name.",
                  "type": "string",
                  "maxLength": 100
                },
                "match": {
                  "type": "string",
                  "enum": ["exact", "broader", "narrower", "related"]
                },
                "note": {
                  "type": "string",
                  "maxLength": 300
                }
              },
              "additionalProperties": false,
              "anyOf": [
                {
                  "required": ["type"],
                  "properties": {
                    "type": true
                  }
                },
                {
                  "required": ["property"],
                  "properties": {
                    "property": true
                  }
                }
              ]
            }
          ]
        }
      },
      "description": "The fields every governed list entry has. Each list's entry definition adds its own fields and closes the entry with unevaluatedProperties."
    },
    "SiteTypeEntry": {
      "description": "An entry in the site type list.",
      "$ref": "#/$defs/Entry",
      "properties": {
        "group": {
          "type": "string",
          "enum": ["overnight", "utility", "services", "attraction", "emergency", "transport"]
        },
        "defers_to": {
          "description": "For a site type whose detailed data lives outside OTWD: what OTWD records and where the rest comes from.",
          "type": "string",
          "maxLength": 500
        }
      },
      "required": ["group"],
      "unevaluatedProperties": false
    },
    "FacilityEntry": {
      "description": "An entry in the facility list, with its attributes.",
      "$ref": "#/$defs/Entry",
      "properties": {
        "attributes": {
          "description": "The attributes the facility carries. They are validated by the facility's schema in values.schema.json.",
          "type": "array",
          "items": {
            "type": "object",
            "required": ["name", "type", "description"],
            "properties": {
              "name": {
                "type": "string",
                "pattern": "^[a-z][a-z0-9_]{0,47}$"
              },
              "type": {
                "type": "string",
                "enum": ["boolean", "integer", "number", "string", "enum", "time", "list"]
              },
              "unit": {
                "type": "string",
                "maxLength": 20
              },
              "values": {
                "type": "array",
                "items": {
                  "type": "string"
                }
              },
              "description": {
                "type": "string",
                "maxLength": 300
              }
            },
            "additionalProperties": false
          }
        },
        "stored_as": {
          "description": "For a facility read from another fact rather than stored in the facilities map: a JSON Pointer to that fact and the rule.",
          "type": "object",
          "required": ["field", "rule"],
          "properties": {
            "field": {
              "type": "string",
              "format": "json-pointer"
            },
            "rule": {
              "type": "string",
              "maxLength": 300
            }
          },
          "additionalProperties": false
        }
      },
      "required": ["safety_fact"],
      "unevaluatedProperties": false
    },
    "PlainEntry": {
      "description": "An entry in a list whose codes carry no attributes: surfaces, vehicle classes and pet species.",
      "$ref": "#/$defs/Entry",
      "unevaluatedProperties": false
    },
    "StructureEntry": {
      "description": "An entry in the structure list. passages lists how a road can pass the structure (over, under, through or along), and a road restriction's passage must be one of them.",
      "$ref": "#/$defs/Entry",
      "properties": {
        "passages": {
          "type": "array",
          "minItems": 1,
          "uniqueItems": true,
          "items": {
            "type": "string",
            "enum": ["over", "under", "through", "along"]
          }
        }
      },
      "required": ["passages"],
      "unevaluatedProperties": false
    },
    "KeySchemeEntry": {
      "description": "An entry in the key scheme list: a central key that opens accessible toilets and other facilities for people with disability. countries lists where the scheme is used, and a site's key scheme must be used in the site's country.",
      "$ref": "#/$defs/Entry",
      "properties": {
        "countries": {
          "type": "array",
          "minItems": 1,
          "uniqueItems": true,
          "items": {
            "$ref": "common.schema.json#/$defs/CountryCode"
          }
        }
      },
      "required": ["countries"],
      "unevaluatedProperties": false
    },
    "RankedEntry": {
      "description": "An entry in an ordered list: vehicle access classes. rank orders the entries from the least to the most restrictive, so a filter can match every class up to the one a vehicle can handle.",
      "$ref": "#/$defs/Entry",
      "properties": {
        "rank": {
          "type": "integer",
          "minimum": 1,
          "maximum": 100
        }
      },
      "required": ["rank"],
      "unevaluatedProperties": false
    }
  }
}
